artifact,status,path,files
Bootstrap Collection v0.3,OK,/mnt/data/TRACE_Bootstrap_Collection_v0_3_2026_06_16.zip,TRACE_bootstrap_collection_v0_3_2026_06_16/README.md; TRACE_bootstrap_collection_v0_3_2026_06_16/01_ACTIVE_BOOTSTRAP_SET/00_TRACE_ROSETTA_CORE__v6_FULL.pdf; TRACE_bootstrap_collection_v0_3_2026_06_16/01_ACTIVE_BOOTSTRAP_SET/01_BOOTSTRAP_FILM__Memento__Memory_Grounds_Identity__v3_FULL.pdf; TRACE_bootstrap_collection_v0_3_2026_06_16/01_ACTIVE_BOOTSTRAP_SET/02_BOOTSTRAP_FILM__Everything_Everywhere_All_At_Once__Bounded_Meaning_Wins__v2_FULL.pdf; TRACE_bootstrap_collection_v0_3_2026_06_16/01_ACTIVE_BOOTSTRAP_SET/03_BOOTSTRAP_FILM__Children_of_Men__Hope_Enables_Continuity__v2_FULL.pdf; TRACE_bootstrap_collection_v0_3_2026_06_16/01_ACTIVE_BOOTSTRAP_SET/04_BOOTSTRAP_FILM__Unthinkable__Ends_Under_Constraint__v2_FULL.pdf; TRACE_bootstrap_collection_v0_3_2026_06_16/01_ACTIVE_BOOTSTRAP_SET/05_BOOTSTRAP_CHARACTER__Samwise_Gamgee__Carry_the_Load_Not_the_Ring__v1.pdf; TRACE_bootstrap_collection_v0_3_2026_06_16/01_ACTIVE_BOOTSTRAP_SET/06_BOOTSTRAP_HISTORY_FILM__Apollo_13__Correction_Before_Hardening__v1.pdf; TRACE_bootstrap_collection_v0_3_2026_06_16/01_ACTIVE_BOOTSTRAP_SET/07_BOOTSTRAP_HISTORY_CHARACTER__Harriet_Tubman__Exit_Routes_Under_Predatory_Law__v1.pdf; TRACE_bootstrap_collection_v0_3_2026_06_16/02_SOURCE_MARKDOWN/00_TRACE_ROSETTA_CORE__v6_FULL_SOURCE.md; TRACE_bootstrap_collection_v0_3_2026_06_16/02_SOURCE_MARKDOWN/01_Memento__v3_FULL_SOURCE.md; TRACE_bootstrap_collection_v0_3_2026_06_16/02_SOURCE_MARKDOWN/02_EEAAO__v2_FULL_SOURCE.md; TRACE_bootstrap_collection_v0_3_2026_06_16/02_SOURCE_MARKDOWN/03_Children_of_Men__v2_FULL_SOURCE.md; TRACE_bootstrap_collection_v0_3_2026_06_16/02_SOURCE_MARKDOWN/04_Unthinkable__v2_FULL_SOURCE.md; TRACE_bootstrap_collection_v0_3_2026_06_16/02_SOURCE_MARKDOWN/05_Samwise_Gamgee__v1_SOURCE.md; TRACE_bootstrap_collection_v0_3_2026_06_16/02_SOURCE_MARKDOWN/06_Apollo_13__Correction_Before_Hardening__v1_SOURCE.md; TRACE_bootstrap_collection_v0_3_2026_06_16/02_SOURCE_MARKDOWN/07_Harriet_Tubman__Exit_Routes_Under_Predatory_Law__v1_SOURCE.md; TRACE_bootstrap_collection_v0_3_2026_06_16/03_SUPPORT/PATCH_NOTES_v0_1_1.md; TRACE_bootstrap_collection_v0_3_2026_06_16/03_SUPPORT/PATCH_NOTES_v0_2.md; TRACE_bootstrap_collection_v0_3_2026_06_16/03_SUPPORT/PATCH_NOTES_v0_2_1.md...
Concordance v0.4,OK,/mnt/data/TRACE_ME_Concordance_v0_4_2026_06_16.zip,TRACE_ME_Concordance_v0_4_2026_06_16/PATCH_NOTES_v0_4.md; TRACE_ME_Concordance_v0_4_2026_06_16/README.md; TRACE_ME_Concordance_v0_4_2026_06_16/SHA256_MANIFEST.md; TRACE_ME_Concordance_v0_4_2026_06_16/TRACE_ME_Concordance_v0_4.md; TRACE_ME_Concordance_v0_4_2026_06_16/TRACE_ME_Concordance_v0_4_case_pair_layer.csv; TRACE_ME_Concordance_v0_4_2026_06_16/TRACE_ME_Concordance_v0_4_table.csv; TRACE_ME_Concordance_v0_4_2026_06_16/TRACE_ME_Concordance_v0_4_tubman_layer.csv
Diagnostic Kernel v0.2,OK,/mnt/data/TRACE_ME_Diagnostic_Kernel_v0_2_2026_06_16.zip,TRACE_ME_Diagnostic_Kernel_v0_2_2026_06_16/FALSIFICATION_DRIFT_CHECK_v0_2.md; TRACE_ME_Diagnostic_Kernel_v0_2_2026_06_16/README.md; TRACE_ME_Diagnostic_Kernel_v0_2_2026_06_16/SHA256_MANIFEST.md; TRACE_ME_Diagnostic_Kernel_v0_2_2026_06_16/TRACE_ME_Diagnostic_Kernel_v0_2.md; TRACE_ME_Diagnostic_Kernel_v0_2_2026_06_16/TRACE_ME_Diagnostic_Kernel_v0_2_worksheet.csv
Claims Ledger v0.3,OK,/mnt/data/TRACE_ME_Claims_Ledger_v0_3_2026_06_16.zip,TRACE_ME_Claims_Ledger_v0_3_2026_06_16/FALSIFICATION_DRIFT_CHECK_v0_3.md; TRACE_ME_Claims_Ledger_v0_3_2026_06_16/README.md; TRACE_ME_Claims_Ledger_v0_3_2026_06_16/SHA256_MANIFEST.md; TRACE_ME_Claims_Ledger_v0_3_2026_06_16/TRACE_ME_Claims_Ledger_v0_3.csv; TRACE_ME_Claims_Ledger_v0_3_2026_06_16/TRACE_ME_Claims_Ledger_v0_3.md
Case Atlas v0.2,OK,/mnt/data/TRACE_ME_Case_Atlas_v0_2_2026_06_16.zip,TRACE_ME_Case_Atlas_v0_2_2026_06_16/FALSIFICATION_DRIFT_CHECK_v0_2.md; TRACE_ME_Case_Atlas_v0_2_2026_06_16/README.md; TRACE_ME_Case_Atlas_v0_2_2026_06_16/SHA256_MANIFEST.md; TRACE_ME_Case_Atlas_v0_2_2026_06_16/TRACE_ME_Case_Atlas_v0_2.csv; TRACE_ME_Case_Atlas_v0_2_2026_06_16/TRACE_ME_Case_Atlas_v0_2.md
AI Review Digest v0.1,OK,/mnt/data/TRACE_ME_AI_Review_Digest_v0_1_2026_06_16.zip,TRACE_ME_AI_Review_Digest_v0_1_2026_06_16/README.md; TRACE_ME_AI_Review_Digest_v0_1_2026_06_16/SHA256_MANIFEST.md; TRACE_ME_AI_Review_Digest_v0_1_2026_06_16/TRACE_ME_AI_Review_Digest_v0_1.csv; TRACE_ME_AI_Review_Digest_v0_1_2026_06_16/TRACE_ME_AI_Review_Digest_v0_1.md
